{
  "dut_id": "sil",
  "station_id": "example-anonymous",
  "outcome": "PASS",
  "start_time_millis": 1788944942564,
  "end_time_millis": 1788945589177,
  "metadata": {
    "everest": {
      "commit": "fdf2ac5415425e0a6af7d30caacf46f2bf9316ee",
      "pointer": "testing/main",
      "testEnvironment": "SIL"
    },
    "build": {
      "status": "passed",
      "modules": ["EvseManager"]
    },
    "integrator": { "id": "example-anonymous" }
  },
  "phases": []
}
